{
  "kind": "roster-policy",
  "version": "1.4.0",
  "pool": [
    {
      "classKey": "adversarial-review",
      "classId": "jcsl:gauntlet:adversarial-review",
      "families": [
        "code-diff",
        "plan-text",
        "doc-text"
      ]
    },
    {
      "classKey": "code-quality-audit",
      "classId": "jcsl:gauntlet:code-quality-audit",
      "families": [
        "code-diff"
      ]
    },
    {
      "classKey": "revision-review",
      "classId": "jcsl:gauntlet:revision-review",
      "families": [
        "code-diff"
      ]
    },
    {
      "classKey": "threat-review",
      "classId": "jcsl:gauntlet:threat-review",
      "families": [
        "code-diff"
      ]
    }
  ],
  "rows": [
    {
      "rowId": "code-behavioral-revision",
      "match": {
        "family": "code-diff",
        "mechanicalOnly": false,
        "revision": true
      },
      "field": [
        {
          "classKey": "revision-review",
          "reason": "revision of a posted review — prior findings need a fate"
        },
        {
          "classKey": "adversarial-review",
          "reason": "behavioral code diff — adversarial surface"
        },
        {
          "classKey": "code-quality-audit",
          "reason": "code diff — rulebook audit applies"
        },
        {
          "classKey": "threat-review",
          "when": "security-signal",
          "reason": "security signal fired — the change touches a trust surface",
          "skipReason": "no security signal fired — the change matched none of the signal table's trust surfaces"
        }
      ],
      "skip": [],
      "gaps": [
        {
          "lane": "go-live-review",
          "when": "golive-flag",
          "reason": "applicable, not yet admitted — run its skill manually"
        }
      ]
    },
    {
      "rowId": "code-mechanical-revision",
      "match": {
        "family": "code-diff",
        "mechanicalOnly": true,
        "revision": true
      },
      "field": [
        {
          "classKey": "revision-review",
          "reason": "revision of a posted review — prior findings need a fate"
        },
        {
          "classKey": "code-quality-audit",
          "reason": "code diff — rulebook audit applies"
        },
        {
          "classKey": "threat-review",
          "when": "security-signal",
          "reason": "security signal fired — the change touches a trust surface",
          "skipReason": "no security signal fired — the change matched none of the signal table's trust surfaces"
        }
      ],
      "skip": [
        {
          "classKey": "adversarial-review",
          "reason": "mechanical-only diff — no behavioral surface to attack"
        }
      ],
      "gaps": [
        {
          "lane": "go-live-review",
          "when": "golive-flag",
          "reason": "applicable, not yet admitted — run its skill manually"
        },
        {
          "lane": "doc-review",
          "when": "doc-only",
          "reason": "applicable, not yet admitted — run its skill manually"
        }
      ]
    },
    {
      "rowId": "code-behavioral",
      "match": {
        "family": "code-diff",
        "mechanicalOnly": false
      },
      "field": [
        {
          "classKey": "adversarial-review",
          "reason": "behavioral code diff — adversarial surface"
        },
        {
          "classKey": "code-quality-audit",
          "reason": "code diff — rulebook audit applies"
        },
        {
          "classKey": "threat-review",
          "when": "security-signal",
          "reason": "security signal fired — the change touches a trust surface",
          "skipReason": "no security signal fired — the change matched none of the signal table's trust surfaces"
        }
      ],
      "skip": [],
      "gaps": [
        {
          "lane": "go-live-review",
          "when": "golive-flag",
          "reason": "applicable, not yet admitted — run its skill manually"
        }
      ]
    },
    {
      "rowId": "code-mechanical",
      "match": {
        "family": "code-diff",
        "mechanicalOnly": true
      },
      "field": [
        {
          "classKey": "code-quality-audit",
          "reason": "code diff — rulebook audit applies"
        },
        {
          "classKey": "threat-review",
          "when": "security-signal",
          "reason": "security signal fired — the change touches a trust surface",
          "skipReason": "no security signal fired — the change matched none of the signal table's trust surfaces"
        }
      ],
      "skip": [
        {
          "classKey": "adversarial-review",
          "reason": "mechanical-only diff — no behavioral surface to attack"
        }
      ],
      "gaps": [
        {
          "lane": "go-live-review",
          "when": "golive-flag",
          "reason": "applicable, not yet admitted — run its skill manually"
        },
        {
          "lane": "doc-review",
          "when": "doc-only",
          "reason": "applicable, not yet admitted — run its skill manually"
        }
      ]
    },
    {
      "rowId": "plan",
      "match": {
        "family": "plan-text"
      },
      "field": [
        {
          "classKey": "adversarial-review",
          "reason": "plan text — adversarial surface"
        }
      ],
      "skip": [
        {
          "classKey": "code-quality-audit",
          "reason": "no profile for family plan-text"
        }
      ],
      "gaps": [
        {
          "lane": "plan-review",
          "when": "always",
          "reason": "applicable, not yet admitted — run its skill manually"
        }
      ]
    },
    {
      "rowId": "doc",
      "match": {
        "family": "doc-text"
      },
      "field": [
        {
          "classKey": "adversarial-review",
          "reason": "doc text — adversarial surface"
        }
      ],
      "skip": [
        {
          "classKey": "code-quality-audit",
          "reason": "no profile for family doc-text"
        }
      ],
      "gaps": [
        {
          "lane": "doc-review",
          "when": "always",
          "reason": "applicable, not yet admitted — run its skill manually"
        }
      ]
    },
    {
      "rowId": "skill",
      "match": {
        "artifactType": "skill"
      },
      "field": [],
      "skip": [
        {
          "classKey": "adversarial-review",
          "reason": "no profile for family"
        },
        {
          "classKey": "code-quality-audit",
          "reason": "no profile for family"
        }
      ],
      "gaps": [
        {
          "lane": "skill-audit",
          "when": "always",
          "reason": "applicable, not yet admitted — run its skill manually"
        }
      ]
    },
    {
      "rowId": "directive",
      "match": {
        "artifactType": "directive"
      },
      "field": [],
      "skip": [
        {
          "classKey": "adversarial-review",
          "reason": "no profile for family"
        },
        {
          "classKey": "code-quality-audit",
          "reason": "no profile for family"
        }
      ],
      "gaps": [
        {
          "lane": "directive-review",
          "when": "always",
          "reason": "applicable, not yet admitted — run its skill manually"
        }
      ]
    }
  ]
}
